,store_id,name,postal_code,address,phone
0,0,札幌店,〒007-0861,北海道札幌市東区伏古一条4-1-1,0120-65-8190
1,1,盛岡店,〒020-0836,岩手県盛岡市津志田西2-17-50 盛岡南ショッピングセンターサンサ内,019-601-8190
2,2,仙台店,〒981-3117,宮城県仙台市泉区市名坂字黒木川原54-1,022-772-8190
3,3,ラパークいわき店,〒970-8044,福島県いわき市中央台飯野4-1(ラパークいわき内),0246-38-9980
4,4,郡山店,〒963-8022,福島県郡山市西ノ内2-20-7,0120-65-8190
5,5,荒川沖店,〒300-1158,茨城県稲敷郡阿見町住吉2-8-7,029-843-8190
6,6,つくば絶版車館,〒300-2445,茨城県つくばみらい市小絹120,029-721-8190
7,7,小山店,〒323-0820,栃木県小山市西城南3-1-12,028-532-8190
8,8,インターパーク宇都宮店,〒321-0118,栃木県宇都宮市インターパーク6-2-9,028-657-8190
9,9,前橋インター店,〒370-0001,群馬県高崎市中尾町44-1 ナップス前橋インター店内,0120-65-8190
10,10,草加店,〒340-0035,埼玉県草加市西町1275-1,048-920-5260
11,11,上尾店,〒362-0001,埼玉県上尾市上257-1,048-778-0817
12,12,入間店,〒358-0012,埼玉県入間市東藤沢3-6-6,0120-65-8190
13,13,東松山店,〒355-0024,埼玉県東松山市六軒町21-14,0120-65-8190
14,14,GLOBO蘇我店,〒260-0835,千葉県千葉市中央区川崎町1-34 GLOBO内,043-265-8190
15,15,柏店,〒277-0005,千葉県柏市柏687-1,047-165-8190
16,16,HUNT 木更津店,〒292-0835,千葉県木更津市築地1-4 イオンモール木更津内,043-830-0190
17,17,市川店,〒272-0131,千葉県市川市湊新田1-3-1,0120-65-8190
18,18,八王子堀之内店,〒192-0362,東京都八王子市松木34-8,0120-65-8190
19,19,府中店,〒185-0023,東京都国分寺市西元町2-3-20,0120-65-8190
20,20,葛飾青戸店,〒125-0062,東京都葛飾区青戸4-2-7,0120-65-8190
21,21,練馬店,〒176-0014,東京都練馬区豊玉南2-16-15,0120-65-8190
22,22,Beat&C 世田谷店,〒158-0082,東京都世田谷区等々力2-6-2,03-6432-3480
23,23,荒川店,〒114-0016,東京都北区上中里3-18-5,0120-65-8190
24,24,中原街道荏原店,〒142-0063,東京都品川区荏原1-16-1,0120-65-8190
25,25,福生店,〒197‐0003,東京都福生市熊川1411-6,0120-65-8190
26,26,世田谷本店,〒154-0023,東京都世田谷区若林3-15-4,0120-65-8190
27,27,相模大野店,〒252-0318,神奈川県相模原市南区上鶴間本町9-46-17,042-701-8190
28,28,平塚店,〒254-0013,神奈川県平塚市田村5-4-21,0120-65-8190
29,29,横浜上郷店,〒247-0013,神奈川県横浜市栄区上郷町152-1,0120-65-8190
30,30,新横浜店,〒222-0011,神奈川県横浜市港北区菊名7-9-25,045-716-9819
31,31,綾瀬店,〒252-1113,神奈川県綾瀬市上土棚中3-1-2,0120-65-8190
32,32,平塚第2ショールーム,〒254-0013,神奈川県平塚市田村4-14-47,0120-65-8190
33,33,秦野店,〒257-0025,神奈川県秦野市落合375-1,0120-65-8190
34,34,藤沢店,〒251-0003,神奈川県藤沢市柄沢1-1-1,0120-65-8190
35,35,茅ヶ崎絶版車館,〒253-0087,神奈川県茅ヶ崎市下町屋1-10-26,046-755-5552
36,36,新潟店,〒950-0941,新潟県新潟市中央区女池5丁目2-25,0120-65-8190
37,37,金沢店,〒920-0362,石川県金沢市古府2-132,0120-65-8190
38,38,甲府店,〒400-0854,山梨県甲府市中小河原町12-2,0120-65-8190
39,39,長野店,〒381-0042,長野県長野市稲田1-34-4,0120-65-8190
40,40,静岡店,〒422-8054,静岡県静岡市駿河区南安倍3-12-1,0120-65-8190
41,41,浜松店,〒435-0047,静岡県浜松市東区原島町525ナップス浜松店内,0120-65-8190
42,42,浜松店 第2ショールーム,〒435-0017,静岡県浜松市東区薬師町81,0120-65-8190
43,43,小牧店,〒485-0016,愛知県小牧市間々原新田下新池947,0120-65-8190
44,44,名古屋みなと店,〒455-0021,愛知県名古屋市港区木場町8-17,052-613-8190
45,45,一宮店,〒491-0834,愛知県一宮市島崎1-1-14,0120-65-8190
46,46,名古屋守山店,〒463-0053,愛知県名古屋市守山区小幡千代田15-9,052-725-8190
47,47,豊橋店,〒441-8105,愛知県豊橋市北山町字西原38-21,0120-65-8190
48,48,岡崎店,〒444-2134,愛知県岡崎市大樹寺1丁目2-2 ファニチャードーム岡崎店1階,056-483-8190
49,49,イオンモール鈴鹿店,〒513-0834,三重県鈴鹿市庄野羽山4丁目1-2 イオンモール鈴鹿 1F,059-392-8190
50,50,京都伏見店,〒612-8392,京都府京都市伏見区下鳥羽北ノ口町20,0120-65-8190
51,51,京都店,〒604-8804,京都府京都市中京区壬生坊城町57-5,0120-65-8190
52,52,京都松井山手店,〒614-8297,京都府八幡市欽明台西40-6,0120-65-8190
53,53,Beat&C 京都八幡店,〒614-8271,京都府八幡市美濃山ヒル塚31­ー1,0120-65-8190
54,54,東大阪店,〒578-0956,大阪府東大阪市横枕西1-26,0120-65-8190
55,55,高石店,〒592-0012,大阪府高石市西取石6-1-36,0120-65-8190
56,56,茨木店,〒567-0034,大阪府茨木市中穂積2-1-2,0120-65-8190
57,57,寝屋川店,〒572-0038,大阪府寝屋川市池田新町19-30,072-814-8191
58,58,りんくうシークル店,〒598-0047,大阪府泉佐野市りんくう往来南3番地(バイクワールドりんくうシークル店内),0120-65-8190
59,59,大阪東住吉店,〒546-0013,大阪府大阪市東住吉区湯里5-18-14,0120-65-8190
60,60,堺美原店,〒587-0022,大阪府堺市美原区平尾290-3,0120-65-8190
61,61,伊丹店,〒664-0831,兵庫県伊丹市北伊丹5-96-1,072-773-8190
62,62,神戸伊川谷店,〒651-2124,兵庫県神戸市西区伊川谷町潤和711-1,078-975-8190
63,63,姫路店,〒670-0057,兵庫県姫路市北今宿2-233-1,0120-65-8190
64,64,バイク王バイクコンシェルジュ　バイクワールド土山店,〒675-0104,兵庫県加古川市平岡町土山776-6,078-944-7918
65,65,奈良店,〒636-0802,奈良県生駒郡三郷町三室1-14-10,0120-65-8190
66,66,岡山店,〒700-0064,岡山県岡山市北区大安寺南町1-1-73,086-236-8190
67,67,広島店,〒734-0022,広島県広島市安佐南区西原2-14-21,0120-65-8190
68,68,広島店第2ショールーム,〒734-0022,広島県広島市南区東雲3-5-21,0120-65-8190
69,69,山口店,〒754-0022,山口県山口市小郡花園町5-28,0120-65-8190
70,70,高松店,〒761-0311,香川県高松市元山町593 バイクワールド高松店内,0120-65-8190
71,71,松山店,〒791-2113,愛媛県伊予郡砥部町拾町20 リバーサイドショッピングセンター内,089-956-8190
72,72,福岡店,〒811-2233,福岡県糟屋郡志免町別府北2-1-16,092-629-8190
73,73,北九州店,〒806-0069,福岡県北九州市八幡西区茶売町2-5,093-632-7880
74,74,久留米店,〒830-0052,福岡県久留米市上津町1164-12,0120-65-8190
75,75,太宰府店,〒818-0134,福岡県太宰府市大佐野2-4 バイクワールド太宰府大佐野店内,0120-65-8190
76,76,小倉店,〒802-0971,福岡県北九州市小倉南区守恒本町2丁目1−33,0120-65-8190
77,77,Beat&C 福岡マリナ店,〒819-0001,福岡県福岡市西区小戸3丁目51−47,0120-65-8190
78,78,熊本店,〒862-0963,熊本県熊本市南区出仲間7-15-15,0120-65-8190
79,79,上熊本店,〒860-0079,熊本県熊本市西区上熊本2-17−39,0120-65-8190
80,80,那覇店,〒900-0004,沖縄県那覇市銘苅266-3,0120-65-8190
81,81,Husqvarna Motorcycles いわき店,〒970-8044,福島県いわき市中央台飯野4-1(ラパークいわき内),0246-38-9659
82,82,KTM小山,〒323-0824,栃木県小山市雨ケ谷新田69-1,0120-65-8190
